{
  "schema_version": "1.0.0",
  "alias_set_id": "retrieval.search_aliases",
  "purpose": "Shared Chinese and domain-term expansions used by local retrieval tools.",
  "aliases": {
    "触发": ["trigger", "activation", "routing"],
    "误触发": ["false", "positive", "adjacent", "activation"],
    "漏触发": ["false", "negative", "activation"],
    "边界": ["boundary", "control", "scope"],
    "权限": ["allowed", "forbidden", "permission", "control"],
    "安全": ["security", "safety", "guardrail", "control"],
    "上下文": ["context", "tokens", "loading"],
    "低上下文": ["context", "short", "node", "budget"],
    "本地": ["local"],
    "检索": ["retrieval", "search"],
    "查询": ["query", "search"],
    "调研": ["research", "source", "evidence", "finding"],
    "研究": ["research", "source", "evidence", "finding"],
    "来源": ["source", "reference", "evidence"],
    "证据": ["evidence", "reference", "source"],
    "资料搜集": ["research", "source", "evidence", "collection", "gather"],
    "搜集": ["research", "source", "collection", "gather"],
    "广度": ["breadth", "coverage", "wide", "fan"],
    "深度": ["depth", "deep", "iterative"],
    "溯源": ["traceability", "provenance", "evidence"],
    "可溯源": ["traceability", "provenance", "evidence"],
    "三角": ["triangulation", "corroboration"],
    "花名册": ["roster", "source", "inventory"],
    "推断": ["inference", "finding"],
    "质量": ["quality"],
    "报告": ["report"],
    "审计": ["audit", "quality", "report"],
    "门禁": ["gate", "quality", "release"],
    "覆盖": ["coverage"],
    "邻接": ["adjacency", "neighbor"],
    "压缩": ["summary", "cards", "compressed"],
    "摘要": ["summary", "cards", "compressed"],
    "结论": ["summary", "result", "decision"],
    "卡片": ["cards", "summary"],
    "提交前": ["quality", "gate", "check", "validation"],
    "短入口": ["agent", "index", "entrypoint", "short"],
    "文档库": ["knowledge", "base", "kb", "documentation"],
    "知识图谱": ["knowledge", "graph", "node", "edge"],
    "测试": ["test", "testing", "eval"],
    "评估": ["eval", "evaluation", "metric"],
    "指标": ["metric", "metrics", "quantitative"],
    "成本": ["cost", "tokens", "latency"],
    "稳定": ["reliability", "stability", "pass"],
    "回归": ["regression", "suite"],
    "发布": ["release", "gate"],
    "回滚": ["rollback", "recovery"],
    "弃用": ["deprecation", "sunset", "migration"],
    "注册表": ["registry", "distribution", "metadata"],
    "版本": ["version", "versioning", "semver"],
    "观测": ["observability", "trace", "span"],
    "轨迹": ["trajectory", "trace", "tool", "call"],
    "工具": ["tool", "tools"],
    "脚手架": ["scaffold", "init", "agent", "cli"],
    "支架": ["scaffold", "principle", "agent"],
    "初始化": ["init", "scaffold"],
    "交互": ["cli", "query", "plan"],
    "模板": ["template"],
    "模板契约": ["template", "contract", "validation"],
    "清单": ["checklist"],
    "契约": ["contract", "schema"],
    "破坏": ["mutation"],
    "退化": ["mutation", "regression"],
    "变异": ["mutation"],
    "蜕变": ["metamorphic"],
    "验收": ["acceptance", "verifier"],
    "失败": ["failure", "red", "regression"],
    "设计": ["design", "architecture"],
    "生命周期": ["lifecycle", "release", "deprecation", "rollback"],
    "工业级": ["industrial", "release", "metrics", "testing", "design"],
    "审查": ["review", "checklist"]
  }
}
